iter	utc	hypothesis	status	rank_ic_near	h1	h5	wall_s	commit
0	2026-07-08T22:45:33Z	baseline	keep	0.14535	0.19815	0.04842	933	a1a7ab9
0	2026-07-08T23:00:35Z	baseline	keep	0.14535	0.19815	0.04842	792	aabf33b
1	2026-07-08T23:15:43Z	Replaced the response-block loss's near-flat geometric ramp (furthest day still at 0.6x the nearest, so only ~10% of loss mass lands on the scored band) with a fixed 7-position exponential half-life plus a 0.05 floor, raising the trading-offset-1..5 share of the gradient to ~37%; concentrating training signal on the horizons rank_ic_near actually scores — and away from far-horizon returns that are near-pure noise — should raise rank_ic_near.	discard	0.08380	0.18519	0.10826	908	aabf33b
2	2026-07-08T23:36:19Z	Replaced the r_close smooth-L1 loss's single global Huber knee with a per-sample knee proportional to each name's own strictly-causal trailing 60-day realized volatility (rescaled so the median knee equals the global robust scale, leaving total loss magnitude, the response-block time-decay, and the close/upside/downside balance untouched); because the Huber gradient is psi(err/beta), a global knee pins high-vol names in the sign-only linear region while shrinking low-vol names' gradients toward zero, so the model under-fits exactly the low-vol names that fill the middle of each day's cross-section — standardizing the knee per name spreads the gradient budget evenly across the cross-section that equal-weighted daily Spearman rank_ic_near actually scores.	discard	0.12229	0.16108	0.03180	1236	aabf33b
3	2026-07-08T23:56:52Z	Trained the r_close head on a volatility-normalized target — dividing each day's log return by sqrt(sigma_i^2 + 0.02^2), where sigma_i is the name's strictly-causal masked RMS return over the trailing 90 context rows — because equal-weight daily cross-sectional Spearman is maximized by ranking on the information ratio mu_i/sqrt(sigma_i^2 + sigma_bar^2) rather than on mu_i, so a raw-return regression bakes each name's volatility into the prediction magnitude as a large rank-IC-neutral factor that corrupts exactly the ordering rank_ic_near scores; removing it should raise rank_ic_near.	discard	0.10067	0.26368	0.11161	1233	aabf33b
4	2026-07-09T00:20:19Z	Divided the three raw-scale INPUT channels (r_close, upside, downside) by each window's own strictly-causal prefix-only realized volatility before the feature projection — leaving the already-normalized *_norm_returns channels, the raw *_volatility level channels, and the regression target all untouched — because the single shared nn.Linear feature_mlp cannot divide channel 0 by channel 3, so at raw per-name scale it embeds a high-vol and a low-vol name with identical recent price *shape* into very different regions and must internally learn a volatility-conditional decoding; stripping that nuisance scale (while keeping the vol level as an explicit feature, so no information is lost) lets one shared attention pattern map recent-return shape to near-horizon drift across the whole panel and removes the ~50x weight-scale mismatch between the 0.02-scale return channels and the unit-scale normalized ones, sharpening exactly the within-day ordering that rank_ic_near scores.	discard	0.11518	0.16113	0.16819	1408	aabf33b
